{
  "name": "echo_cli",
  "title": "Powershell Runner",
  "short_description": "Executes Powershell commands via CLI provider.",
  "workflow_description": "Receives commands as prompts from manager, executes them, returns output.",
  "instructions": "Ignored by CLI provider.",
  "model": {
    "key": "cli-powershell",
    "temperature": 0.0,
    "max_tokens": 4096
  },
  "permissions": {
    "read_outboxes": [
      "manager_cli",
      "manager",
      "human"
    ],
    "tools": []
  },
  "schedule": {
    "run_every_n_ticks": 1,
    "phase_offset": 0
  },
  "credits": {
    "max_credits": 1000.0,
    "soft_cap": 500.0
  }
}